{
  "kind": "other",
  "session": "356cc977-00dd-4889-9e26-0aa587d3d220",
  "cwd": "/Users/user/dev/subspace/tools/hook-capture/claude-code",
  "claude_code": {
    "kind": "instructions.load",
    "transcript_path": "/Users/user/.claude/projects/-Users-user-dev-subspace-tools-hook-capture-claude-code/356cc977-00dd-4889-9e26-0aa587d3d220.jsonl",
    "prompt_id": "dec15486-5eba-44da-a88d-bab7bc5a01fe"
  }
}
