{
  "kind": "turn.stop",
  "session": "b57f0fcd-6655-4fac-b576-4e6053746794",
  "cwd": "/Users/user/dev/subspace/tools/hook-capture/claude-code",
  "claude_code": {
    "kind": "turn.stop",
    "transcript_path": "/Users/user/.claude/projects/-Users-user-dev-subspace-tools-hook-capture-claude-code/b57f0fcd-6655-4fac-b576-4e6053746794.jsonl",
    "prompt_id": "33c3cdea-1aab-4a69-a6d0-5427283c9d41",
    "permission_mode": "default",
    "last_assistant_message": "I made one Bash call that wrote `alpha` and `beta` to `captures/s20.txt` using a heredoc. It finished with no output and I did not check the file afterward.",
    "background_tasks": [],
    "background_agents": [],
    "background_shells": []
  }
}
