{
  "kind": "tool.pre",
  "session": "078d4786-cd8d-49c2-93ba-73158fa14f25",
  "tool_call": "toolu_013jzeATpEyMhsytRP5LePzt",
  "tool": "shell",
  "cwd": "/Users/user/dev/subspace/tools/hook-capture/claude-code",
  "claude_code": {
    "kind": "tool.pre",
    "transcript_path": "/Users/user/.claude/projects/-Users-user-dev-subspace-tools-hook-capture-claude-code/078d4786-cd8d-49c2-93ba-73158fa14f25.jsonl",
    "prompt_id": "75722c7d-6571-49ac-a7d6-47f7c5ff225c",
    "permission_mode": "default",
    "tool_name": "Bash",
    "tool_input": {
      "command": "touch captures/perm-two",
      "description": "Create file captures/perm-two"
    },
    "command": "touch captures/perm-two",
    "command_description": "Create file captures/perm-two"
  }
}
