{
  "kind": "other",
  "session": "70df4d87-5cf7-455a-bbbf-9d65ca03a023",
  "agent": "a49678b26aced2971",
  "cwd": "/Users/user/dev/subspace/tools/hook-capture",
  "claude_code": {
    "kind": "tool.batch",
    "transcript_path": "/Users/user/.claude/projects/-Users-user-dev-subspace-tools-hook-capture/70df4d87-5cf7-455a-bbbf-9d65ca03a023.jsonl",
    "prompt_id": "80437e56-0841-408c-b8a8-895d6706839c",
    "permission_mode": "default",
    "agent_type": "general-purpose"
  }
}
