{
  "kind": "tool.post",
  "session": "70df4d87-5cf7-455a-bbbf-9d65ca03a023",
  "agent": "a39f8e1822e441b9e",
  "tool_call": "toolu_01BbbMNUfp2TPRezrKEWyp5n",
  "tool": "shell",
  "cwd": "/Users/user/dev/subspace/tools/hook-capture",
  "claude_code": {
    "kind": "tool.post",
    "transcript_path": "/Users/user/.claude/projects/-Users-user-dev-subspace-tools-hook-capture/70df4d87-5cf7-455a-bbbf-9d65ca03a023.jsonl",
    "prompt_id": "80437e56-0841-408c-b8a8-895d6706839c",
    "permission_mode": "default",
    "agent_type": "general-purpose",
    "tool_name": "Bash",
    "tool_input": {
      "command": "sleep 3; echo alpha",
      "description": "Run sleep and echo command to see output"
    },
    "tool_response": {
      "stdout": "alpha",
      "stderr": "",
      "interrupted": false,
      "isImage": false,
      "noOutputExpected": false
    },
    "duration_ms": 3486,
    "command": "sleep 3; echo alpha",
    "command_description": "Run sleep and echo command to see output"
  }
}
