{
  "kind": "other",
  "session": "de12188a-8f53-4c70-be34-9c73f91e972b",
  "cwd": "/Users/user/dev/subspace/tools/hook-capture/claude-code",
  "claude_code": {
    "kind": "session.end",
    "transcript_path": "/Users/user/.claude/projects/-Users-user-dev-subspace-tools-hook-capture-claude-code/de12188a-8f53-4c70-be34-9c73f91e972b.jsonl",
    "prompt_id": "d4630e6a-d66f-40ff-bd7c-4d0821f0253b",
    "end_reason": "prompt_input_exit"
  }
}
