{
  "kind": "session.start",
  "session": "356cc977-00dd-4889-9e26-0aa587d3d220",
  "cwd": "/Users/user/dev/subspace/tools/hook-capture/claude-code",
  "claude_code": {
    "kind": "session.start",
    "transcript_path": "/Users/user/.claude/projects/-Users-user-dev-subspace-tools-hook-capture-claude-code/356cc977-00dd-4889-9e26-0aa587d3d220.jsonl",
    "start_source": "resume"
  }
}
