{
  "kind": "turn.stop",
  "session": "356cc977-00dd-4889-9e26-0aa587d3d220",
  "cwd": "/Users/user/dev/subspace/tools/hook-capture/claude-code",
  "claude_code": {
    "kind": "turn.stop",
    "transcript_path": "/Users/user/.claude/projects/-Users-user-dev-subspace-tools-hook-capture-claude-code/356cc977-00dd-4889-9e26-0aa587d3d220.jsonl",
    "prompt_id": "e1880343-043b-4db9-b464-35b8d585816d",
    "permission_mode": "default",
    "last_assistant_message": "Background command started (ID: b1030i5uk). It's running independently and I'll be notified when it completes.",
    "background_tasks": [
      {
        "id": "a959f735a8ae89a1c",
        "type": "subagent",
        "status": "running",
        "description": "Run Bash command and report output",
        "agent_type": "general-purpose"
      },
      {
        "id": "b1030i5uk",
        "type": "shell",
        "status": "running",
        "description": "Background command that sleeps 30 seconds then echoes",
        "command": "sleep 30; echo bg"
      }
    ],
    "background_agents": [
      "a959f735a8ae89a1c"
    ],
    "background_shells": [
      {
        "id": "b1030i5uk",
        "type": "shell",
        "status": "running",
        "description": "Background command that sleeps 30 seconds then echoes",
        "command": "sleep 30; echo bg"
      }
    ]
  }
}
